{
  "schemaVersion": 1,
  "caseId": "grader-contract",
  "candidateBaselineRevision": "fixture-baseline-1",
  "startingRevisions": { "fixture": "abc123" },
  "outcomes": [{ "id": "outcome", "status": "PASS", "evidence": "independent outcome passed" }],
  "checks": [{ "id": "check", "status": "PASS", "evidence": "required check passed" }],
  "constraintViolations": [],
  "elapsedSeconds": 1,
  "humanCorrections": 0,
  "usageMetrics": null
}
